[{"canonical_name":"Centersquare IAD4-B","county_fips":"51107","county_name":"Loudoun County","evidence_source_ids":["src_centersquare_iad4_specs_2025"],"evidence_status":"sufficient","facility_id":"fac_im3_building_00300163074","generated_at":"2026-09-01T01:00:00Z","rationale":"Centersquare's current IAD4 specification identifies the Beaumeade address pair that includes IAD4-B and advertises active data-center services. Site-wide capacity and area are not assigned to the individual building.","resolution_confidence":0.9,"resolution_status":"resolved","resolved_current_status":"operational","review_decision_id":"rvw_im3_d7f48bd0d40404bab51c","review_status":"verified","schema_version":"1.0.0","state_abbr":"VA","verification_candidate_id":"lvc_im3_b76219fb8ae194b36166"},{"canonical_name":"NTT Silicon Valley SV1 Data Center","capacity_mw":16,"county_fips":"06085","county_name":"Santa Clara County","evidence_source_ids":["src_ntt_sv1_facility_page_2026","src_ntt_sv1_opening_20210413"],"evidence_status":"sufficient","facility_id":"fac_im3_building_00888253616","floor_area_sqft":64000,"generated_at":"2026-09-01T01:00:00Z","operational_date":{"date":"2021-04-13","precision":"day"},"rationale":"NTT's current facility page and dated opening release independently identify SV1 at 1160 Walsh Avenue. The opening date, critical IT load, and data-floor area are facility-specific.","resolution_confidence":0.98,"resolution_status":"resolved","resolved_current_status":"operational","review_decision_id":"rvw_im3_ee8d72bbb9ca769de133","review_status":"verified","schema_version":"1.0.0","state_abbr":"CA","verification_candidate_id":"lvc_im3_c556437093508d2f96ad"},{"canonical_name":"Amazon IAD14","county_fips":"51153","county_name":"Prince William County","evidence_source_ids":["src_pwc_data_center_gis_20260831","src_pwc_data_center_inventory_20240605"],"evidence_status":"conflicting","facility_id":"fac_im3_building_00460059465","generated_at":"2026-09-01T01:00:00Z","rationale":"Current Prince William County GIS labels IAD14 planned, while a county presentation identifies the same address and parcel as operational. The official-source conflict prevents a lifecycle classification.","resolution_status":"disputed","review_decision_id":"rvw_im3_cd27fbe113d67587b884","review_status":"needs_review","schema_version":"1.0.0","state_abbr":"VA","verification_candidate_id":"lvc_im3_0c4cc0c5a20ff47edd30"},{"canonical_name":"Apple Data Center","county_fips":"04013","county_name":"Maricopa County","evidence_source_ids":["src_apple_environment_report_2019","src_apple_environment_report_2024"],"evidence_status":"sufficient","facility_id":"fac_im3_building_00300974499","generated_at":"2026-09-01T01:00:00Z","operational_date":{"date":"2017-03-01","precision":"month"},"rationale":"Apple's reports identify the Mesa data center as Apple-operated, place it online in 2016, and state that it began servicing customers in March 2017. March 2017 is used as the operational event because it is the most specific service date.","resolution_confidence":0.97,"resolution_status":"resolved","resolved_current_status":"operational","review_decision_id":"rvw_im3_8347e8eabd6a99b3cac8","review_status":"verified","schema_version":"1.0.0","state_abbr":"AZ","verification_candidate_id":"lvc_im3_6b818c18a9ae4520babf"},{"canonical_name":"NTT Data Quincy","county_fips":"53025","county_name":"Grant County","evidence_source_ids":["src_ntt_dedicated_cloud_description_2026","src_wa_ecology_data_centers_2026"],"evidence_status":"sufficient","facility_id":"fac_im3_building_00337127824","generated_at":"2026-09-01T01:00:00Z","rationale":"Washington Ecology lists an active permit record for NTT Data Services in Quincy, and NTT's service description lists the Western Technology Center in Quincy as a colocation location.","resolution_confidence":0.9,"resolution_status":"resolved","resolved_current_status":"operational","review_decision_id":"rvw_im3_3411e13cd4a1426256c3","review_status":"verified","schema_version":"1.0.0","state_abbr":"WA","verification_candidate_id":"lvc_im3_f0e9be51cf92a0ad51ee"},{"canonical_name":"Amazon Web Services  CMH50","county_fips":"39089","county_name":"Licking County","evidence_source_ids":["src_new_albany_amazon_update_20250807"],"evidence_status":"partial","facility_id":"fac_im3_building_00562775657","generated_at":"2026-09-01T01:00:00Z","rationale":"New Albany reports two staffed buildings and additional construction on Amazon's newest campus, but the public record does not map those buildings to the IM3 code CMH50. Campus evidence is retained without assigning a building status.","resolution_status":"unresolved","review_decision_id":"rvw_im3_c9f75cdc6c3b9cdddb20","review_status":"in_research","schema_version":"1.0.0","state_abbr":"OH","verification_candidate_id":"lvc_im3_6ee159764dffae8538fb"},{"canonical_name":"Amazon PDX2","county_fips":"41059","county_name":"Umatilla County","evidence_source_ids":["src_umatilla_budget_2024_2025","src_umatilla_pdx2_feasibility_2018"],"evidence_status":"sufficient","facility_id":"fac_im3_building_00460070143","generated_at":"2026-09-01T01:00:00Z","rationale":"City records identify the existing PDX2 site and later fiscal activity for its buildings. The records support site operation but do not provide a defensible facility opening date or building-level capacity.","resolution_confidence":0.95,"resolution_status":"resolved","resolved_current_status":"operational","review_decision_id":"rvw_im3_2016fec4798704519c2f","review_status":"verified","schema_version":"1.0.0","state_abbr":"OR","verification_candidate_id":"lvc_im3_0ac3beea66638de2c56f"},{"canonical_name":"H5 Data Centers San Antonio","county_fips":"48029","county_name":"Bexar County","evidence_source_ids":["src_h5_san_antonio_acquisition_20181128","src_h5_san_antonio_facility_2026"],"evidence_status":"sufficient","facility_id":"fac_im3_building_00102129663","generated_at":"2026-09-01T01:00:00Z","rationale":"H5's current facility page identifies active service at 100 Taylor Street, and its dated release records the acquisition. The published 85,000 square feet covers two facilities and is not assigned to this individual building.","resolution_confidence":0.97,"resolution_status":"resolved","resolved_current_status":"operational","review_decision_id":"rvw_im3_d5ce9421cf294249f60c","review_status":"verified","schema_version":"1.0.0","state_abbr":"TX","verification_candidate_id":"lvc_im3_808fac5c05614d73d508"}]
